<?xml version="1.0" encoding="UTF-8"?>

<!-- Simeon Warner $Id: provenance-test1.xml,v 1.2 2002/07/01 19:20:30 simeon Exp $ -->

<provenance xmlns="http://www.openarchives.org/OAI/2.0/provenance"
  xmlns:xsi="http://www.w3.org/2001/XMLSchema-instance"
  xsi:schemaLocation="http://www.openarchives.org/OAI/2.0/provenance
                      http://www.openarchives.org/OAI/2.0/provenance.xsd">

<originDescription harvestDate="2002-02-02T14:10:02Z" altered="true">
  <baseURL>http://the.oa.org</baseURL>
  <identifier>oai:r2.org:klik001</identifier>
  <datestamp>2002-01-01</datestamp>
  <metadataNamespace>http://www.openarchives.org/OAI/2.0/oai_dc/</metadataNamespace>
  <originDescription harvestDate="2002-01-01T11:10:01Z" altered="false">
    <baseURL>http://some.oa.org</baseURL>
    <identifier>oai:r2.org:klik001</identifier>
    <datestamp>2001-01-01</datestamp>
    <metadataNamespace>http://www.openarchives.org/OAI/2.0/oai_dc/</metadataNamespace>
  </originDescription>
</originDescription>

</provenance>
